907114,"The inadequacy of the 4 aminoquinolines for protection against latent BENIGN TERTIAN MALARIA is noted, and the use of PRIMAQUINE is recommended.",BENIGN TERTIAN MALARIA,70,91,PRIMAQUINE,118,128,0.0980580676,0.9805806757,-0.8529128986,-0.9264564493,-0.9509709662,-0.96322822465,-0.97058257972,-0.9754854831,-0.978987556942857,-0.981614112325,-0.983656988733333,-1,-1,BENIGN TERTIAN MALARIA,PRIMAQUINE,RO-may_prevent
907118,Studies in patients scheduled for percutaneous coronary intervention and those with unstable angina or non-Q-wave myocardial infarction have shown that a combination of intravenous GP IIb-IIIa inhibitors with ASPIRIN and heparin is associated with a reduction in death or MYOCARDIAL INFARCTION compared with therapy with aspirin and heparin alone,MYOCARDIAL INFARCTION,272,293,ASPIRIN,209,216,0,0.943456353,-1,-1,-1,-1,-1,-1,-1,-1,-1,-1,-1,MYOCARDIAL INFARCTION,ASPIRIN,RO-may_prevent
907131,"The object of the present investigation was to identify those who, among high risk patients, would break through LOW DOSE HEPARIN PROPHYLAxis and develop thromboeMBOLISM AFTER MAjor abdominal surgery.",MBOLISM AFTER MA,162,177,LOW DOSE HEPARIN PROPHYLA,113,138,0.5070925528,0.6761234038,0.9178487588,0.90757985365,0.8943769756,0.8767731382,0.85212776584,-0.8732268618,-0.891337310114286,-0.90492014635,-0.915484574533333,-1,1,THROMBOEMBOLISM,HEPARIN,RO-may_prevent
907148,"No CARIES protective effect of the FETAL FLUORIDE however, has been substantiated by pertinent research.",CARIES,3,8,FETAL FLUORIDE,35,49,0.3441236008,0.9176629355,0.8906872668,0.87702317515,0.859455057314286,-0.8709536497,-0.89676291976,-0.9139690998,-0.9262592284,-0.93547682485,-0.942646066533333,-1,-1,CARIES,FLUORIDE,RO-may_prevent
907152,The principal differences between these vaccines are the transmission of live vaccine viruses from recipieits to their contacts and the occurrence of occasional cases of PARALYTIC POLIOMYELITIS associated with use of LIVE POLIOVIRUS VACCINE,PARALYTIC POLIOMYELITIS,170,192,LIVE POLIOVIRUS VACCINE,217,240,0.7035264707,0.7035264707,0.950587745116667,0.94441121325625,0.936469958007143,0.925881617675,0.91105794121,0.8888224265125,0.85176323535,-0.86808878674375,-0.882745588216667,-1,1,POLIOMYELITIS,LIVE POLIOVIRUS VACCINE,RO-may_prevent
907157,"The diagnosis of MAGNESIUM DEFICIENCY is usually made by a low serum magnesium concentration, although the MAGNESIUM TOLERANCE TEST may be more indicative of low magnesium states.",MAGNESIUM DEFICIENCY,17,36,MAGNESIUM TOLERANCE TEST,107,131,0.10976426,0.9878783399,0.851627376666667,-0.917676805,-0.94511787,-0.9588384025,-0.967070722,-0.972558935,-0.976479087142857,-0.97941920125,-0.981705956666667,-1,-1,MAGNESIUM DEFICIENCY,MAGNESIUM,RO-may_prevent
907161,The most significant results of this study are the level of hydration of the PC headgroup and the lack of DEHYDRATION with INCREASING TEMPERATURE AND SALT ADDITION.,DEHYDRATION,106,116,INCREASING TEMPERATURE AND SALT ADDITION,123,163,0.1458649915,0.875189949,0.85764416525,-0.890601256375,-0.92706750425,-0.9453006281875,-0.95624050255,-0.963533752125,-0.968743216107143,-0.97265031409375,-0.975689168083333,-1,-1,DEHYDRATION,SALT,RO-may_prevent
907168,Clinical trials are currently investigating the potential value of LMWHs in the treatment of PULMONARY EMBOLISM and as an alternative to WARFARIN in secondary prevention of DVT,PULMONARY EMBOLISM,93,111,WARFARIN,137,145,0,0.9950371902,-1,-1,-1,-1,-1,-1,-1,-1,-1,-1,-1,PULMONARY EMBOLISM,WARFARIN,RO-may_prevent
907174,This study concluded that the addition of LIDOCAINE significantly reduced the PAIN felt in the circulatory tract selected for the injection of propofol.,PAIN,78,81,LIDOCAINE,42,51,0.0824786099,0.9897433186,-0.87628208515,-0.938141042575,-0.95876069505,-0.9690705212875,-0.97525641703,-0.979380347525,-0.982326012164286,-0.98453526064375,-0.986253565016667,-1,-1,PAIN,LIDOCAINE,RO-may_prevent
907179,"In 1984, three patients died of severe hypoglycemia after receiving PENTAMIDINE ISETHIONATE to treat PNEUMOCYSTIS PNEUMONIA",PNEUMOCYSTIS PNEUMONIA,101,123,PENTAMIDINE ISETHIONATE,68,91,0.2860387768,0.9534625892,0.8810064628,0.86613227065,-0.8569806116,-0.8927354587,-0.91418836696,-0.9284903058,-0.9387059764,-0.94636772935,-0.952326870533333,-1,-1,PNEUMOCYSTIS PNEUMONIA,PENTAMIDINE ISETHIONATE,RO-may_prevent
907183,When administered intravenously in the dorsum of the hand the pain score and the number of patients who experienced PAIN was reduced significantly by mixing the agent with LIGNOCAINE when compared with a bolus injection,PAIN,116,120,LIGNOCAINE,172,182,0,0.9958932065,-1,-1,-1,-1,-1,-1,-1,-1,-1,-1,-1,PAIN,LIGNOCAINE,RO-may_prevent
907203,"Ondansetron was superior to high dose metoclopramide in controlling ACUTE EMESIS and nausea, and there was a significant patient preference for ONDANSETRON",ACUTE EMESIS,68,80,ONDANSETRON,144,155,0,0.990147543,-1,-1,-1,-1,-1,-1,-1,-1,-1,-1,-1,EMESIS,ONDANSETRON,RO-may_prevent
907208,"The protocols for the practical management of these cases, including the immunisation of susceptible non human primates and the staff with recombinant HEPATITIS B VACCINE are described, and the origin and evolution of HEPATITIS B INFECTION in primates are discussed.",HEPATITIS B INFECTION,218,238,HEPATITIS B VACCINE,151,170,0.0877058019,0.9647638212,-0.86844129715,-0.934220648575,-0.95614709905,-0.9671103242875,-0.97368825943,-0.978073549525,-0.981205899592857,-0.98355516214375,-0.98538236635,-1,-1,HEPATITIS B INFECTION,HEPATITIS B VACCINE,RO-may_prevent
907209,"In developing PTU-treated rats, the abnormalities completely disappeared after therapy with increasing physiological doses of THYROXINE; consequently they were directly related to THYROID DEFICIENCY and not to toxic effects of PTU",THYROID DEFICIENCY,180,198,THYROXINE,126,135,0,0.762000762,-1,-1,-1,-1,-1,-1,-1,-1,-1,-1,-1,THYROID DEFICIENCY,THYROXINE,RO-may_prevent
907215,The incidence of SYMPTOMATIC URINARY TRACT INFECTION also decreased during treatment with METHENAMINE HIPPURATE,SYMPTOMATIC URINARY TRACT INFECTION,17,52,METHENAMINE HIPPURATE,90,111,0.0877058019,0.9647638212,-0.86844129715,-0.934220648575,-0.95614709905,-0.9671103242875,-0.97368825943,-0.978073549525,-0.981205899592857,-0.98355516214375,-0.98538236635,-1,-1,URINARY TRACT INFECTION,METHENAMINE HIPPURATE,RO-may_prevent
907219,An example of AIDS research being helpful in the treatment of other conditions is the use of GANCICLOVIR for prevention of CMV INFECTION in transplant patients  who are vulnerable to infections because of the immune suppressive drugs they must take.,CMV INFECTION,123,135,GANCICLOVIR,93,104,0,0.9958932065,-1,-1,-1,-1,-1,-1,-1,-1,-1,-1,-1,CMV INFECTION,GANCICLOVIR,RO-may_prevent
907223,This paper reviews the probable mechanism of DENTAL CARIES and the role of FLUORIDE in the inhibition or reversal of that process.,DENTAL CARIES,45,57,FLUORIDE,75,83,0,0.9941348468,-1,-1,-1,-1,-1,-1,-1,-1,-1,-1,-1,DENTAL CARIES,FLUORIDE,RO-may_prevent
907226,"Among the compounds tested, 1 (2 hydroxy 3 (4 phenylpiperidin 1 yl) propylpyrrolidin 2 one (5) was the most active in the PROPHYLACTIC ANTIARRHYTHMIC ACTIVITY in ADRENALINE INDUCED ARRHYTHMIA in anesthetized rats.",ADRENALINE INDUCED ARRHYTHMIA,162,190,PROPHYLACTIC ANTIARRHYTHMIC ACTIVITY,122,158,0.4008918629,0.6681531048,0.900148643816667,0.88766722429375,0.871619684907143,0.850222965725,-0.87973244113,-0.899777034275,-0.914094600807143,-0.92483277570625,-0.933184689516667,-1,-1,ARRHYTHMIA,ANTIARRHYTHMIC,RO-may_prevent
907227,"At the same time, regulations may forbid claims that a food product prevents disease, even when it does (e.gFOLIC ACID which reduces the risk of NEURAL TUBE DEFECTS",NEURAL TUBE DEFECTS,145,163,FOLIC ACID,108,118,0,0.9733285268,-1,-1,-1,-1,-1,-1,-1,-1,-1,-1,-1,NEURAL TUBE DEFECTS,FOLIC ACID,RO-may_prevent
907233,"Regarding iron chelation treatment, patients receiving combined therapy with DEFERIPRONE AND DEFEROXAMINE (DFO) significantly reduced MYOCARDIAL IRON OVERLOAD during the 4 yr study period, whilst patients in monotherapy with DFO showed a significant increase in LIC.",MYOCARDIAL IRON OVERLOAD,134,157,DEFERIPRONE AND DEFEROXAMINE (DFO),77,111,0,1,-1,-1,-1,-1,-1,-1,-1,-1,-1,-1,-1,IRON OVERLOAD,DEFEROXAMINE,RO-may_prevent
907235,Famotidine 40 mg given once at night appears to be as safe and effective as conventional therapy with RANITIDINE indicating the importance of overnight gastric acidity in the pathogenesis of DUODENAL ULCER DISEASE,DUODENAL ULCER DISEASE,191,212,RANITIDINE,102,112,0,0.9938837347,-1,-1,-1,-1,-1,-1,-1,-1,-1,-1,-1,DUODENAL ULCER DISEASE,RANITIDINE,RO-may_prevent
907239,It is concluded that the ANTIARRHYTHMIC action of L PC on REOXYGENATION INDUCED ARRHYTHMIAS is not correlated with its direct electrophysiological effects studied on normoxic preparations.,REOXYGENATION INDUCED ARRHYTHMIAS,58,91,ANTIARRHYTHMIC,25,39,0.1767766953,0.8838834765,0.862796115883333,-0.867417478525,-0.91161165235,-0.9337087392625,-0.94696699141,-0.955805826175,-0.962119279578571,-0.96685436963125,-0.97053721745,-1,-1,ARRHYTHMIAS,ANTIARRHYTHMIC,RO-may_prevent
907247,"Remarkable examples are arteriosclerosis and its complications, where the role of thromboxane and prostacyclin was discovered and led to the development of strategies for the prevention of MYOCARDIAL INFARCTION by ACETYLSALICYLIC ACID",MYOCARDIAL INFARCTION,189,209,ACETYLSALICYLIC ACID,214,234,0,0.9974586998,-1,-1,-1,-1,-1,-1,-1,-1,-1,-1,-1,MYOCARDIAL INFARCTION,ACETYLSALICYLIC ACID,RO-may_prevent
907265,"In rats with a coronary occlusion of 6 weeks duration, RAMIPRIL administration significantly reduced infarct size and prevented the development of LEFT VENTRICULAR HYPERTROPHY",LEFT VENTRICULAR HYPERTROPHY,147,174,RAMIPRIL,55,63,0,1,-1,-1,-1,-1,-1,-1,-1,-1,-1,-1,-1,LEFT VENTRICULAR HYPERTROPHY,RAMIPRIL,RO-may_prevent
907269,The results show that high F groundwater is prevalent and emphasize that information on domestic water supply must be available before SUPPLEMENTARY FLUORIDE is prescribed for CARIES PROPHYLACTIC PURPOSE.,CARIES PROPHYLACTIC PURPOSE,176,202,SUPPLEMENTARY FLUORIDE,135,157,0,0.9950371902,-1,-1,-1,-1,-1,-1,-1,-1,-1,-1,-1,CARIES,FLUORIDE,RO-may_prevent
907273,Eight patients achieved good control of nausea and EMESIS with ondansetron alone while two patients required ONDANSETRON and diphenhydramine,EMESIS,51,57,ONDANSETRON,109,120,0.214422507,0.9649012814,0.869070417833333,0.8527042200625,-0.8927887465,-0.919591559875,-0.9356732479,-0.94639437325,-0.954052319928571,-0.9597957799375,-0.9642629155,-1,-1,EMESIS,ONDANSETRON,RO-may_prevent
907299,Comparison of low intensity warfarin therapy with CONVENTIONAL INTENSITY WARFARIN THERAPY for long term prevention of RECURRENT VENOUS THROMBOEMBOLISM,RECURRENT VENOUS THROMBOEMBOLISM,118,149,CONVENTIONAL INTENSITY WARFARIN THERAPY,50,89,0,0.9950371902,-1,-1,-1,-1,-1,-1,-1,-1,-1,-1,-1,THROMBOEMBOLISM,WARFARIN,RO-may_prevent
907302,In the past the inhibition of CARIES by FLUORIDES was ascribed to the reduced solubility of enamel due to the incorporation of F  into the enamel mineral.,CARIES,30,35,FLUORIDES,40,49,0,0.9534625892,-1,-1,-1,-1,-1,-1,-1,-1,-1,-1,-1,CARIES,FLUORIDES,RO-may_prevent
907304,"Therefore, vaccination of all children AT BIRTH WITH HEPATITIS B VACCINE COULD BE AN effective vaccine strategy despite a low INCIDENCE OF VERTICAL HEPATITIS B TRANSMISSION.",INCIDENCE OF VERTICAL HEPATITIS B TRANSMISSION,126,171,AT BIRTH WITH HEPATITIS B VACCINE COULD BE AN,39,83,0.5477225575,0.7302967433,0.92462042625,0.91519797953125,0.903083405178571,0.886930639375,0.86431676725,-0.863069360625,-0.882630880535714,-0.89730202046875,-0.908712907083333,-1,1,HEPATITIS B,HEPATITIS B VACCINE,RO-may_prevent
907308,RUBELLA VACCINE should continue to be used to immunize susceptible adult women against RUBELLA in order to further the goal of elimination of the congenital rubella syndrome,RUBELLA,87,94,RUBELLA VACCINE,0,15,0,1,-1,-1,-1,-1,-1,-1,-1,-1,-1,-1,-1,RUBELLA,RUBELLA VACCINE,RO-may_prevent
907310,The scientific evidence supports the efficacy of FLUORIDE SUPPLEMENTS in CARIES prevention but there is weaker support for their effectiveness.,CARIES,73,78,FLUORIDE SUPPLEMENTS,49,69,0,0.979957887,-1,-1,-1,-1,-1,-1,-1,-1,-1,-1,-1,CARIES,FLUORIDE,RO-may_prevent
907321,"Despite the successes of DEFEROXAMINE (DFO) in the treatment and prevention of IRON OVERLOAD an effective orally available iron chelating drug is needed, since erratic compliance with irritating, cumbersome parenteral infusions still results in fatal iron accumulation in many patients.",IRON OVERLOAD,79,91,DEFEROXAMINE,25,37,0,0.9970544855,-1,-1,-1,-1,-1,-1,-1,-1,-1,-1,-1,IRON OVERLOAD,DEFEROXAMINE,RO-may_prevent
907323,QUININE SULFATE is a widely prescribed drug for NOCTURNAL CRAMPS,NOCTURNAL CRAMPS,48,63,QUININE SULFATE,0,15,0,0.9965457582,-1,-1,-1,-1,-1,-1,-1,-1,-1,-1,-1,CRAMPS,QUININE SULFATE,RO-may_prevent
907332,Indoprofen at the daily dose of 600 mg was comparable in efficacy with 900 MG OF IBUPROFEN in the relief of PAIN RELATED TO OSTEOARTHROSIS.,PAIN RELATED TO OSTEOARTHROSIS,108,137,900 MG OF IBUPROFEN,71,90,0,0.9958932065,-1,-1,-1,-1,-1,-1,-1,-1,-1,-1,-1,PAIN,IBUPROFEN,RO-may_prevent
907345,"In order to evaluate the preventive effect of estrogen and vitamin D3 on POSTMENOPAUSAL BONE LOSS, either ESTROGEN (Premarin 0.625 mg/day) or vitamin D3 (Onealfa 1.0 micrograms/day) was administered to postmenopausal women",POSTMENOPAUSAL BONE LOSS,73,97,ESTROGEN,106,114,0.1632993162,0.9797958971,0.860549886033333,-0.87752551285,-0.9183503419,-0.938762756425,-0.95101020514,-0.95917517095,-0.965007289385714,-0.9693813782125,-0.9727834473,-1,-1,POSTMENOPAUSAL BONE LOSS,ESTROGEN,RO-may_prevent
907355,These data suggest that subclinical RIBOFLAVIN DEFICIENCY may occur in adolescents and that deficiency may be related to dietary intake of RIBOFLAVIN,RIBOFLAVIN DEFICIENCY,36,57,RIBOFLAVIN,36,46,0.809039835,0.809039835,0.968173305833333,0.9641949690625,0.959079964642857,0.95225995875,0.9427119505,0.928389938125,0.9045199175,0.85677987625,-0.8651600275,-1,1,RIBOFLAVIN DEFICIENCY,RIBOFLAVIN,RO-may_prevent
907359,The object of the study was to determine whether dexamethasone improved the efficacy of the serotonin receptor (5 HT3) antagonist granisetron in controlling acute (within 24 h) emesis in cancer patients receiving high dose cisplatin chemotherapy and to ascertain whether continuation of GRANISETRON after 24 h reduces the occurrence of delayed EMESIS,EMESIS,344,349,GRANISETRON,287,298,0,0.9931270663,-1,-1,-1,-1,-1,-1,-1,-1,-1,-1,-1,EMESIS,GRANISETRON,RO-may_prevent
907364,"The decreased bone magnesium concentration and the increased retention of magnesium in the magnesium load test suggest MAGNESIUM DEFICIENCY in post menoposal osteoporosis, probably caused by MAGNESIUM MALABSORPTION.",MAGNESIUM DEFICIENCY,119,139,MAGNESIUM MALABSORPTION,191,214,0.9958932065,0.9958932065,0.999315534416667,0.99922997621875,0.999119972821429,0.998973301625,0.99876796195,0.9984599524375,0.99794660325,0.996919904875,0.99383980975,-1,1,MAGNESIUM DEFICIENCY,MAGNESIUM,RO-may_prevent
907365,"After an outbreak of hepatitis in Washington, D.C. in 1970 among a group of persons taking isoniazid to prevent TUBERCULOSIS an ISONIAZID surveillance study was conducted among 13,838 persons in 21 participating health departments.",TUBERCULOSIS,112,123,ISONIAZID,128,137,0,0.9036961141,-1,-1,-1,-1,-1,-1,-1,-1,-1,-1,-1,TUBERCULOSIS,ISONIAZID,RO-may_prevent
907372,The screening usually consists of measuring thyroxin in dried blood spot specimens followed by measurement of thyrotropin if the results for THYROXIN are suggestive of HYPOTHYROIDISM,HYPOTHYROIDISM,168,181,THYROXIN,141,149,0.7372097808,0.7372097808,0.956201630133333,0.9507268339,0.943687810171429,0.9343024452,0.92116293424,0.9014536678,0.8686048904,-0.8617731661,-0.8771317032,-1,-1,HYPOTHYROIDISM,THYROXIN,RO-may_prevent
907376,"ANTIANGINAL EFFICACY was assessed with ANGINA DIARES investigators, and patients global evaluations and with treadmill exercise test during placebo run in period and after 8 weeks of the therapy.",ANGINA DIARES,39,52,ANTIANGINAL EFFICACY,0,20,0.1690308509,0.8451542547,0.861505141816667,-0.873226861825,-0.91548457455,-0.9366134309125,-0.94929074473,-0.957742287275,-0.963779103378571,-0.96830671545625,-0.971828191516667,-1,-1,ANGINA,ANTIANGINAL,RO-may_prevent
907379,"? Adherence to a gluten free diet in patients with celiac disease can lead to the correction of IRON DEFICIENCY ANEMIA and the replacement of iron stores, and it can prevent the recurrence of IRON deficiency.",IRON DEFICIENCY ANEMIA,96,117,IRON,96,100,0.4850712501,0.8488746876,0.914178541683333,0.90345085939375,0.889658125021429,0.871267812525,-0.85447862497,-0.878732187475,-0.896056160692857,-0.90904914060625,-0.91915479165,-1,1,IRON DEFICIENCY ANEMIA,IRON,RO-may_prevent
907380,"In 75% of supraventricular parossistic tachycardia and in 75% of parossistic atrial fibrillation, arrhythmia was interrupted within few minutes from drug injection; in 90% with premature ventricular contractions (PVC) and in 100% of VENTRICULAR TACHYCARDIA DISOPYRAMIDE was capable to interrupt the arrhythmias.",VENTRICULAR TACHYCARDIA,233,255,DISOPYRAMIDE,257,269,0,0.6761234038,-1,-1,-1,-1,-1,-1,-1,-1,-1,-1,-1,VENTRICULAR TACHYCARDIA,DISOPYRAMIDE,RO-may_prevent
907382,"Transdermal scopolamine provides significant MOTION SICKNESS protection, similar in extent to that provided by oral SCOPOLAMINE or dimenhydrinate.",MOTION SICKNESS,45,59,SCOPOLAMINE,116,127,0,0.8660254038,-1,-1,-1,-1,-1,-1,-1,-1,-1,-1,-1,MOTION SICKNESS,SCOPOLAMINE,RO-may_prevent
907383,All patients have remained free of ARRHYTHMIA recurrence and have required no ANTIARRHYTHMIC THERAPY after a follow up of 5 to 28 months (mean 14.,ARRHYTHMIA,35,44,ANTIARRHYTHMIC THERAPY,78,100,0.0890870806,0.979957887,-0.8663693791,-0.93318468955,-0.9554564597,-0.966592344775,-0.97327387582,-0.97772822985,-0.9809099113,-0.9832961723875,-0.985152153233333,-1,-1,ARRHYTHMIA,ANTIARRHYTHMIC,RO-may_prevent
907385,"The results show that the FLUORIDE ION concentration is sufficient (0.7 1.0 ppm F ) to prevent CARIES only in very few parts of Lower Austria, Upper Austria, Salzburg, Tirol, Carinthia, and Styria.",CARIES,95,100,FLUORIDE ION,26,38,0,0.9931270663,-1,-1,-1,-1,-1,-1,-1,-1,-1,-1,-1,CARIES,FLUORIDE ION,RO-may_prevent
907386,The choice of the antiarrhythmic treatment must always be based on the type of ARRHYTHMIA the presence of a structural cardiopathy and the potential side effects of the ANTIARRHYTHMIC drug.,ARRHYTHMIA,79,88,ANTIARRHYTHMIC,169,183,0.4961389384,0.7442084075,0.9160231564,0.90552605095,0.892029772514286,0.8740347346,-0.85115831848,-0.8759652654,-0.8936845132,-0.90697394905,-0.917310176933333,-1,1,ARRHYTHMIA,ANTIARRHYTHMIC,RO-may_prevent
907396,The use of PHENYTOIN in headache syndromes and in prevention of POST-TRAUMATIC EPILEPSY is discussed,POST-TRAUMATIC EPILEPSY,64,87,PHENYTOIN,11,20,0,1,-1,-1,-1,-1,-1,-1,-1,-1,-1,-1,-1,POST-TRAUMATIC EPILEPSY,PHENYTOIN,RO-may_prevent
907397,There was no difference in the rate of regression of sensory anesthesia or the development of PAIN among patients receiving BUPIVACAINE alone or bupivacaine with fentanyl,PAIN,94,98,BUPIVACAINE,124,135,0.91914503,0.91914503,0.986524171666667,0.984839693125,0.982673935,0.9797862575,0.975743509,0.96967938625,0.959572515,0.9393587725,0.878717545,-1,1,PAIN,BUPIVACAINE,RO-may_prevent
907404,"Rationale: ? The combination of heparin and ASPIRIN in ACS reduces the incidence of MI during the in hospital period, and LMWHs reduce cardiac events and the need for revascularization procedures.",MI,84,85,ASPIRIN,44,51,0,0.968495997,-1,-1,-1,-1,-1,-1,-1,-1,-1,-1,-1,MI,ASPIRIN,RO-may_prevent
907406,51   The identification of neurotransmitter pathways involved in chemotherapy INDUCED NAUSEA AND VOMITING led to development of potent ANTIEMETICS such as the serotonin antagonists ondansetron and granisetron.,INDUCED NAUSEA AND VOMITING,78,104,ANTIEMETICS,135,146,0.6030226892,0.7537783614,0.933837114866667,0.925566754225,0.9149334334,0.9007556723,0.88090680676,0.85113350845,-0.870780852314286,-0.886933245775,-0.899496218466667,-1,1,VOMITING,ANTIEMETICS,RO-may_prevent
907439,Our results suggest that the heart rate dependence of REENTRANT ARRHYTHMIAS might be of prognostic value in the administration of ANTIARRHYTHMIC DRUGS,REENTRANT ARRHYTHMIAS,54,74,ANTIARRHYTHMIC DRUGS,130,150,0.2156655464,0.8626621856,0.869277591066667,0.85293728995,-0.8921672268,-0.9191254201,-0.93530033608,-0.9460836134,-0.953785954342857,-0.95956271005,-0.964055742266667,-1,1,ARRHYTHMIAS,ANTIARRHYTHMIC DRUGS,RO-may_prevent
907445,Some misunderstandings exist internationally about the efficacy of the ACTIVE FORM OF VITAMIN D for the treatment of OSTEOPOROSIS,OSTEOPOROSIS,117,128,ACTIVE FORM OF VITAMIN D,71,95,0,1,-1,-1,-1,-1,-1,-1,-1,-1,-1,-1,-1,OSTEOPOROSIS,VITAMIN D,RO-may_prevent
907449,The lower incidence of EMESIS recorded by the ONDANSETRON groups compared with the droperidol group was not statistically significant.,EMESIS,23,28,ONDANSETRON,46,57,0.2519763153,0.8819171037,0.875329385883333,0.85974555911875,-0.87401184235,-0.9055088817625,-0.92440710541,-0.937005921175,-0.946005075292857,-0.95275444088125,-0.95800394745,-1,-1,EMESIS,ONDANSETRON,RO-may_prevent
907453,The results suggest that the low serum vitamin A levels in primary biliary cirrhosis are not a consequence of VITAMIN A DEFICIENCY but instead reflect a DEFECTIVE MOBILIZATION OF VITAMIN A FROM THE LIVER.,VITAMIN A DEFICIENCY,110,129,DEFECTIVE MOBILIZATION OF VITAMIN A FROM THE LIVER,153,203,0.5303300859,0.5303300859,0.921721680983333,0.91193689110625,0.899356446978571,0.882582521475,0.85909902577,-0.867417478525,-0.886357838735714,-0.90056310889375,-0.91161165235,-1,1,VITAMIN A DEFICIENCY,VITAMIN A,RO-may_prevent
907476,ERYTHROMYCIN failure in the treatment of SYPHILIS in a pregnant woman.,SYPHILIS,41,48,ERYTHROMYCIN,0,12,0.1203858531,0.9630868247,0.853397642183333,-0.909710610175,-0.93980707345,-0.9548553050875,-0.96388424407,-0.969903536725,-0.974203031478571,-0.97742765254375,-0.97993569115,-1,-1,SYPHILIS,ERYTHROMYCIN,RO-may_treat
907481,"Clonidine, oxymetazoline, tetrahydozoline, brimonidine, tizanidine; barbiturates; opioids; benzodiazepines  Give naloxone for suspected OPIOID OVERDOSE; consider FLUMAZENIL for benzodiazepine overdose Cholinergic (pinpoint pupils; variable HR; sweaty skin; abdominal cramps and diarrhea)  Organophosphate and carbamate insecticides; chemical warfare nerve agents  Give atropine and pralidoxime; obtain measurements of serum and RBC cholinesterase activity Anticholinergic (agitation; delirium; dilated pupils; tachycardia; decreased peristalsis; dry, flushed skin)  Atropine and related drugs; antihistamines; carbamazepine; phenothiazines; tricyclic antidepressants  Obtain immediate ECG.",FLUMAZENIL,162,172,OPIOID OVERDOSE,136,151,0.4423258685,0.5897678246,0.907054311416667,0.89543610034375,0.880498400392857,0.860581467125,-0.86730223945,-0.889418532875,-0.905215885321428,-0.91706389965625,-0.926279021916667,-1,-1,OVERDOSE,FLUMAZENIL,RO-may_treat
907486,"1]  Lindholm LH, Ibsen H, Dahlof B, Devereux RB, Beevers G, de Faire U, et al. Cardiovascular morbidity and mortality in patients with diabetes in the LOSARTAN INTERVENTION FOR ENDPOINT reduction in HYPERTENSION study (LIFE): a randomised trial against atenolol.",HYPERTENSION,199,210,LOSARTAN INTERVENTION FOR ENDPOINT,151,185,0.4472135955,0.894427191,0.907868932583333,0.89635254915625,0.881545770464286,0.861803398875,-0.86583592135,-0.888196601125,-0.90416851525,-0.91614745084375,-0.92546440075,-1,-1,HYPERTENSION,LOSARTAN,RO-may_treat
907491,"Other agents used in the second line treatment of HYPERCALCEMIA OF MALIGNANCY include plicamycin, CALCITONIN gallium nitrate, and the glucocorticoids.",HYPERCALCEMIA OF MALIGNANCY,50,76,CALCITONIN,98,108,0.089802651,0.9878291611,-0.8652960235,-0.93264801175,-0.9550986745,-0.966324005875,-0.9730592047,-0.97754933725,-0.980756574785714,-0.9831620029375,-0.9850328915,-1,-1,HYPERCALCEMIA,CALCITONIN,RO-may_treat
907492,"Weiss RB, Freiman J, Kweder SL, et al. Hemolytic anemia after FLUDARABINE THERAPY for CHRONIC LYMPHOCYTIC LEUKEMIA",CHRONIC LYMPHOCYTIC LEUKEMIA,86,113,FLUDARABINE THERAPY,62,81,0,0.979957887,-1,-1,-1,-1,-1,-1,-1,-1,-1,-1,-1,CHRONIC LYMPHOCYTIC LEUKEMIA,FLUDARABINE,RO-may_treat
907497,17of 18 women with hirsutism treated with combination therapy of FLUTAMIDE 250 mg twice daily and an oral contraceptive pill had a rapid and marked reduction in their HIRSUTISM score.,HIRSUTISM,167,176,FLUTAMIDE,65,74,0,0.9965457582,-1,-1,-1,-1,-1,-1,-1,-1,-1,-1,-1,HIRSUTISM,FLUTAMIDE,RO-may_treat
907499,Aldactone and ACEBUTOLOL in treatment of HYPERTENSION,HYPERTENSION,41,52,ACEBUTOLOL,14,24,0,1,-1,-1,-1,-1,-1,-1,-1,-1,-1,-1,-1,HYPERTENSION,ACEBUTOLOL,RO-may_treat
907500,"Lipton RB, Stewart WF, Ryan RE et al. Efficacy and safety of ACETAMINOPHEN aspirin, and caffeine in alleviating MIGRAINE HEADACHE PAIN",MIGRAINE HEADACHE PAIN,112,133,ACETAMINOPHEN,61,74,0,0.9938837347,-1,-1,-1,-1,-1,-1,-1,-1,-1,-1,-1,PAIN,ACETAMINOPHEN,RO-may_treat
907503,Alendronate is used alone or in fixed combination with CHOLECALCIFEROL (vitamin D 3 ) for treatment of OSTEOPOROSIS in postmenopausal women,OSTEOPOROSIS,103,115,CHOLECALCIFEROL,55,70,0,1,-1,-1,-1,-1,-1,-1,-1,-1,-1,-1,-1,OSTEOPOROSIS,CHOLECALCIFEROL,RO-may_treat
907508,Fluconazole compared with AMPHOTERICIN B plus flucytosine for CRYPTOCOCCAL MENINGITIS in AIDS: a randomized trial.,CRYPTOCOCCAL MENINGITIS,62,84,AMPHOTERICIN B,26,40,0,0.9649012814,-1,-1,-1,-1,-1,-1,-1,-1,-1,-1,-1,CRYPTOCOCCAL MENINGITIS,AMPHOTERICIN B,RO-may_treat
