902042,In most of the patients the STROKE came as a debut of vascular abnormalities in the BRAIN,BRAIN,84,88,STROKE,28,34,0.2407717062,0.9630868247,0.873461951033333,0.8576446949125,-0.8796141469,-0.909710610175,-0.92776848814,-0.93980707345,-0.948406062957143,-0.9548553050875,-0.9598713823,-1,-1,BRAIN,STROKE,RO-disease_has_primary_anatomic_site
902058,Cytokines produced by immune cells infiltrating PANCREATIC ISLETS are important mediators of beta cell destruction in INSULIN DEPENDENT DIABETES MELLITUS,PANCREATIC ISLETS,48,64,INSULIN DEPENDENT DIABETES MELLITUS,118,153,0.2747211279,0.6868028197,0.879120187983333,0.86401021148125,-0.86263943605,-0.8969795770375,-0.91758366163,-0.931319718025,-0.941131186878571,-0.94848978851875,-0.95421314535,-1,-1,PANCREATIC ISLETS,DIABETES MELLITUS,RO-disease_has_primary_anatomic_site
902059,The activation of the urokinase system has been observed during re epithelialization of SKIN WOUNDS and in lesions of the autoimmune BLISTERING SKIN DISEASE PEMPHIGUS,SKIN WOUNDS,88,98,BLISTERING SKIN DISEASE PEMPHIGUS,133,166,0.790569415,0.790569415,0.9650949025,0.9607317653125,0.9551220175,0.94764235375,0.9371708245,0.921463530625,0.8952847075,-0.8517682346875,-0.868238430833333,-1,1,SKIN,PEMPHIGUS,RO-disease_has_primary_anatomic_site
902065,With respect to the ATROPHIC BRAIN in cases of HYDROCEPHALUS the fronto nasal approach appeared to be the best and less traumatic way of exposing the frontal base of the skull.,ATROPHIC BRAIN,20,33,HYDROCEPHALUS,47,60,0.8846517369,0.8846517369,0.980775289483333,0.97837220066875,0.97528251505,0.971162934225,0.96539552107,0.9567444013375,0.94232586845,0.913488802675,-0.85255804385,-1,1,BRAIN,HYDROCEPHALUS,RO-disease_has_primary_anatomic_site
902066,Chemotherapy causes ALOPECIA by damaging HAIR STEM CELLS and hair follicles making the hair brittle and causing scalp hair to break off or fall out.,ALOPECIA,20,28,HAIR STEM CELLS,41,55,0.9486832981,0.9486832981,0.99144721635,0.99037811839375,0.989003563878571,0.987170824525,0.98460498943,0.9807562367875,0.97434164905,0.961512473575,0.92302494715,-1,1,HAIR,ALOPECIA,RO-disease_has_primary_anatomic_site
902071,BREAST EPITHELIAL STEM CELLS are thought to be the primary targets in the aetiology of BREAST CANCER,BREAST EPITHELIAL STEM CELLS,0,27,BREAST CANCER,87,100,0.2373563316,0.9494253266,0.872892721933333,0.857004312175,-0.8813218342,-0.91099137565,-0.92879310052,-0.9406609171,-0.949137928942857,-0.955495687825,-0.9604406114,-1,-1,BREAST,BREAST CANCER,RO-disease_has_primary_anatomic_site
902076,"Interleukin 6 (IL 6) is an attractive candidate gene for osteoporosis susceptibility, because it has effects on BONE CELLS and has been implicated in the pathogenesis of OSTEOPOROSIS",BONE CELLS,112,121,OSTEOPOROSIS,170,182,0.5298129428,0.7947194142,0.921635490466667,0.911839926775,0.8992456306,0.8824532357,0.85894388284,-0.8675467643,-0.886468655114286,-0.900660073225,-0.911697842866667,-1,-1,BONE,OSTEOPOROSIS,RO-disease_has_primary_anatomic_site
902077,"As therapeutic agents of choice in the treatment of complicated infections, glycopeptide antibiotics are often preferentially used in cases of OSTEOMYELITIS an infection located in BONE and notoriously difficult to successfully manage.",BONE,181,185,OSTEOMYELITIS,143,156,0,0.9938837347,-1,-1,-1,-1,-1,-1,-1,-1,-1,-1,-1,BONE,OSTEOMYELITIS,RO-disease_has_primary_anatomic_site
902085,"Shortly after intravenous injection of 99mTechnetium pertechnetate (99mTcO4 )(200 muCi), the activity of the KNEE JOINTS was studied in patients with CLINICAL ARTHRITIS of one or both knees and compared with that in normal subjects.",KNEE JOINTS,109,119,CLINICAL ARTHRITIS,150,168,0,0.9759000729,-1,-1,-1,-1,-1,-1,-1,-1,-1,-1,-1,JOINTS,ARTHRITIS,RO-disease_has_primary_anatomic_site
902088,Intra articular application of Placenta in the arthritis JOINTS of patients with RHEUMATOID ARTHRITIS results in a significant improvement as compared with placebo.,JOINTS,57,62,RHEUMATOID ARTHRITIS,81,101,0,0.9486832981,-1,-1,-1,-1,-1,-1,-1,-1,-1,-1,-1,JOINTS,RHEUMATOID ARTHRITIS,RO-disease_has_primary_anatomic_site
902097,"The autologous membrane bound antibodies strongly recognized cell surface antigens on four human ovarian cell lines and four surgical specimens of human OVARIAN ADENOCARCINOMA but did not react with normal human OVARIES non ovarian normal and neoplastic tissues, or non ovarian human cell lines by indirect immunofluorescence assay.",OVARIES,212,219,OVARIAN ADENOCARCINOMA,153,175,0,0.9449111825,-1,-1,-1,-1,-1,-1,-1,-1,-1,-1,-1,OVARIES,OVARIAN ADENOCARCINOMA,RO-disease_has_primary_anatomic_site
902099,"In conclusion, NSE was considered to be very useful as a tumor MARKER OF THE LUNG especially in small cell carcinoma for diagnosis and determination of disease extent and response to therapy, and also in non SMALL CELL CARCINOMA for the evaluation of treatment effectiveness.",MARKER OF THE LUNG,63,80,SMALL CELL CARCINOMA,208,228,0,0.9370425713,-1,-1,-1,-1,-1,-1,-1,-1,-1,-1,-1,LUNG,SMALL CELL CARCINOMA,RO-disease_has_primary_anatomic_site
902102,"The restoration of blood flow to a part of the body previously deprived of adequate circulation, such as the heart muscle (in myocardial infarction) or the BRAIN (in STROKE",BRAIN,156,160,STROKE,166,172,0.2309401077,0.8082903769,0.871823351283333,0.85580127019375,-0.88452994615,-0.9133974596125,-0.93071796769,-0.942264973075,-0.950512834064286,-0.95669872980625,-0.96150998205,-1,-1,BRAIN,STROKE,RO-disease_has_primary_anatomic_site
902110,"Applications of endoscopic US in the STOMACH include staging of GASTRIC CARCINOMA localization and characterization of nonmucosal gastric masses, detection and evaluation of gastric varices, and evaluation of gastric lymphoma.",STOMACH,37,43,GASTRIC CARCINOMA,64,81,0.123091491,0.9847319278,0.853848581833333,-0.90768138175,-0.9384542545,-0.953840690875,-0.9630725527,-0.96922712725,-0.973623251928571,-0.9769203454375,-0.9794847515,-1,-1,STOMACH,GASTRIC CARCINOMA,RO-disease_has_primary_anatomic_site
902112,The distribution of OKM 5 positive dendritic cells in the epidermis was investigated in 75 cases of INFLAMMATORY DERMATOSES and in 14 cases of normal human SKIN by immunohistochemical and morphometric methods.,SKIN,156,159,INFLAMMATORY DERMATOSES,100,123,0,0.9759000729,-1,-1,-1,-1,-1,-1,-1,-1,-1,-1,-1,SKIN,DERMATOSES,RO-disease_has_primary_anatomic_site
902113,The results indicate that the function of the inhibitory system in the BRAIN is selectively vulnerable during CEREBRAL ISCHEMIA,BRAIN,71,75,CEREBRAL ISCHEMIA,110,127,0.2847473987,0.9491579958,0.880791233116667,0.86589013725625,-0.85762630065,-0.8932197254875,-0.91457578039,-0.928813150325,-0.938982700278571,-0.94660986274375,-0.952542100216667,-1,-1,BRAIN,CEREBRAL ISCHEMIA,RO-disease_has_primary_anatomic_site
902119,"The only exception is the Freiburg Documentation CENTRE FOR SEVERE SKIN DISEASES which is attempting comprehensive, country wide documentation of TOXIC EPIDERMAL NECROLYSIS (LYELL'S SYNDROME) and Stevens Johnson syndrome.",CENTRE FOR SEVERE SKIN DISEASES,49,79,TOXIC EPIDERMAL NECROLYSIS (LYELL'S SYNDROME),146,191,0,0.8571428571,-1,-1,-1,-1,-1,-1,-1,-1,-1,-1,-1,SKIN,TOXIC EPIDERMAL NECROLYSIS,RO-disease_has_primary_anatomic_site
902120,Quantitative counts of ferruginous bodies were performed on digests of LUNGS from 100 control and 30 LUNG CANCER patients.,LUNGS,71,75,LUNG CANCER,101,112,0,0.8164965809,-1,-1,-1,-1,-1,-1,-1,-1,-1,-1,-1,LUNGS,LUNG CANCER,RO-disease_has_primary_anatomic_site
902125,The possibility that the distribution of skin lesions in some cutaneous diseases is due to variations in the ANTIGENIC PROPERTIES OF SKIN was investigated by mapping the expression of the SKIN SPECIFIC PEMPHIGUS VULGARIS and bullous pemphigoid antigens in different regions of the body.,ANTIGENIC PROPERTIES OF SKIN,109,136,SKIN SPECIFIC PEMPHIGUS VULGARIS,188,220,0.5163977795,0.6454972244,0.919399629916667,0.90932458365625,0.89637095275,0.879099444875,0.85491933385,-0.870900555125,-0.889343332964286,-0.90317541634375,-0.913933703416667,-1,-1,SKIN,PEMPHIGUS VULGARIS,RO-disease_has_primary_anatomic_site
902134,"If islet cell tolerance could be re induced, a major clinical hurdle to curing DIABETES by ISLET CELL NEOGENESIS may be overcome.",ISLET CELL NEOGENESIS,91,111,DIABETES,79,87,0.0830454799,0.9965457582,-0.87543178015,-0.937715890075,-0.95847726005,-0.9688579450375,-0.97508635603,-0.979238630025,-0.982204540021429,-0.98442897251875,-0.986159086683333,-1,-1,ISLET CELL,DIABETES,RO-disease_has_primary_anatomic_site
902135,"Between 1994 and 1998, a total of 790 feather, hair and SKIN specimens from a variety of animals with suspected DERMATOPHYTOSES were studied, of which 248 (31.4%) yielded dermatophytes.",SKIN,56,59,DERMATOPHYTOSES,112,127,0.1091089451,0.9819805061,0.851518157516667,-0.918168291175,-0.94544552745,-0.9590841455875,-0.96726731647,-0.972722763725,-0.976619511764286,-0.97954207279375,-0.981815175816667,-1,1,SKIN,DERMATOPHYTOSES,RO-disease_has_primary_anatomic_site
902140,Pathogenesis of HASHIMOTO'S THYROIDITIS is largely cell mediated immune destruction of the THYROID,THYROID,28,34,HASHIMOTO'S THYROIDITIS,16,39,0.3417430631,0.9397934235,0.890290510516667,0.87657682433125,0.858944942092857,-0.8718463513375,-0.89747708107,-0.914564234225,-0.926769343621429,-0.93592317566875,-0.943042822816667,-1,1,THYROID,HASHIMOTO'S THYROIDITIS,RO-disease_has_primary_anatomic_site
902157,"Altogether, 1924 women were studied: 42.8% with a normal CERVIX 16.2% with CERVICAL INTRAEPITHELIAL NEOPLASIA (CIN I), 12.7% with CIN II, 20.8% with CIN III, and 7.6% with invasive cervical cancer (ICC.",CERVIX,57,62,CERVICAL INTRAEPITHELIAL NEOPLASIA (CIN I),75,117,0,0.8846517369,-1,-1,-1,-1,-1,-1,-1,-1,-1,-1,-1,CERVIX,CERVICAL INTRAEPITHELIAL NEOPLASIA,RO-disease_has_primary_anatomic_site
902160,"Protoporphyrins sometimes accumulate to toxic levels in the LIVER causing LIVER FAILURE; if this occurs, a liver transplant becomes necessary.",LIVER FAILURE,74,87,LIVER,60,64,0.3127716211,0.9383148633,0.88546193685,0.87114467895625,0.85273677595,-0.8827106420875,-0.90616851367,-0.921807094725,-0.932977509764286,-0.94135532104375,-0.947871396483333,-1,-1,LIVER,LIVER FAILURE,RO-disease_has_primary_anatomic_site
902170,Bile REFLUX TO THE STOMACH is believed as one of the important PATHOGENESIS OF RESIDUAL GASTRITIS however the prevention for bile reflux cannot always heal the gastritis.,PATHOGENESIS OF RESIDUAL GASTRITIS,63,97,REFLUX TO THE STOMACH,5,25,0.6575959492,0.6575959492,0.9429326582,0.935799240475,0.9266277034,0.9143989873,0.89727878476,0.87159848095,-0.859086582314286,-0.876700759525,-0.890400675133333,-1,1,STOMACH,GASTRITIS,RO-disease_has_primary_anatomic_site
902176,"Acute onset of an illness (over minutes to several hours) involving the SKIN mucosal tissue, or both (e.g., GENERALIZED HIVES; pruritus or flushing; swollen lips, tongue, or uvula) and at least one of the following:  a.",SKIN,72,75,GENERALIZED HIVES,108,125,0.0819231921,0.9830783046,-0.87711521185,-0.938557605925,-0.95903840395,-0.9692788029625,-0.97542304237,-0.979519201975,-0.982445030264286,-0.98463940148125,-0.98634613465,-1,-1,SKIN,HIVES,RO-disease_has_primary_anatomic_site
902178,"In all centers, independent of the aluminum staining technique used, the extent of aluminum deposited in bone was greater in patients presenting with LOW BONE TURNOVER whether from LOW TURNOVER OSTEOMALACIA or adynamic bone disease, than in the predominant hyperparathyroid bone disease.",LOW BONE TURNOVER,150,166,LOW TURNOVER OSTEOMALACIA,181,206,0.9491579958,0.9491579958,0.991526332633333,0.9904671242125,0.989105284814286,0.98728949895,0.98474739874,0.980934248425,0.9745789979,0.96186849685,0.9237369937,-1,1,BONE,OSTEOMALACIA,RO-disease_has_primary_anatomic_site
902183,"WT BONE explanted into Hyp mice developed RICKETS and osteomalacia, but Hyp bone explanted into WT mice displayed persistent osteomalacia and abnormalities in the primary spongiosa, indicating that both phosphate and PHEX independently regulate extracellular matrix mineralization.",RICKETS,42,48,WT BONE,0,6,0.9950371902,0.9950371902,0.999172865033333,0.9990694731625,0.998936540757143,0.99875929755,0.99851115706,0.998138946325,0.9975185951,0.99627789265,0.9925557853,-1,1,BONE,RICKETS,RO-disease_has_primary_anatomic_site
902192,Short  and long term co cultures of 49 cases of human osteosarcoma cells with BONE MARROW or peripheral blood cells of patients with different types of LEUKEMIA were studied.,BONE MARROW,78,88,LEUKEMIA,152,160,0,0.9773555549,-1,-1,-1,-1,-1,-1,-1,-1,-1,-1,-1,BONE MARROW,LEUKEMIA,RO-disease_has_primary_anatomic_site
902194,"MASTOCYTOSIS is a heterogeneous group of disorders characterized by mast cell HYPERPLASIA IN THE BONE MARROW LIVER SPLEEN LYMPH nodes, gastrointestinal tract, and skin.",HYPERPLASIA IN THE BONE MARROW LIVER SPLEEN LYMPH,78,126,MASTOCYTOSIS,0,12,0.9282791216,0.9282791216,0.988046520266667,0.9865523353,0.984631240342857,0.9820697804,0.97848373648,0.9731046706,0.9641395608,0.9462093412,0.8924186824,-1,1,BONE MARROW,MASTOCYTOSIS,RO-disease_has_primary_anatomic_site
902197,Many similarities exist between cerebral ischemia and EPILEPSY regarding BRAIN-damaging and auto-protective mechanisms that are activated following the injurious insult,BRAIN,73,78,EPILEPSY,54,62,0.1690308509,0.6761234038,0.861505141816667,-0.873226861825,-0.91548457455,-0.9366134309125,-0.94929074473,-0.957742287275,-0.963779103378571,-0.96830671545625,-0.971828191516667,-1,-1,BRAIN,EPILEPSY,RO-disease_has_primary_anatomic_site
902198,"29  Inflammatory bowel disease   Typically, INFLAMMATORY BOWEL DISEASES (e.g., ULCERATIVE COLITIS and Crohn disease) produce inflammatory diarrhea, with blood and pus in the stool.",INFLAMMATORY BOWEL DISEASES,44,70,ULCERATIVE COLITIS,79,97,0.6154574549,0.7385489459,0.935909575816667,0.92789827279375,0.91759802605,0.903864363725,0.88463723647,0.8557965455875,-0.868116259664286,-0.88460172720625,-0.897423757516667,-1,-1,BOWEL,ULCERATIVE COLITIS,RO-disease_has_primary_anatomic_site
902200,The distribution of ferruginous bodies in the LUNGS of ten LUNG CANCER patients with definite occupational history of asbestos exposure and the kind of core fibers in the center of the ferruginous bodies were evaluated.,LUNGS,46,50,LUNG CANCER,59,70,0,0.9819805061,-1,-1,-1,-1,-1,-1,-1,-1,-1,-1,-1,LUNGS,LUNG CANCER,RO-disease_has_primary_anatomic_site
902202,"In the oral cavity, LYMPHANGIOMA is a rare, non odontogenic, benign neoplasm which originates from LYMPH VESSELS",LYMPHANGIOMA,20,32,LYMPH VESSELS,99,111,0.4364357805,0.8728715609,0.906072630083333,0.89433170884375,0.879236238678571,0.859108945125,-0.86906926585,-0.890891054875,-0.906478047035714,-0.91816829115625,-0.92726070325,-1,-1,LYMPH VESSELS,LYMPHANGIOMA,RO-disease_has_primary_anatomic_site
902218,"A diagnosis of CHRONIC EOSINOPHILIC LEUKAEMIA was made on the basis of myeloproliferative involvement of both peripheral blood and BONE MARROW, associated with eosinophilic differentiation and a t(5;12)(q33;p13) translocation",BONE MARROW,131,142,CHRONIC EOSINOPHILIC LEUKAEMIA,15,45,0.179605302,0.7184212081,0.863267550333333,-0.8652960235,-0.910197349,-0.93264801175,-0.9461184094,-0.9550986745,-0.961513149571429,-0.966324005875,-0.970065783,-1,-1,BONE MARROW,CHRONIC EOSINOPHILIC LEUKAEMIA,RO-disease_has_primary_anatomic_site
902221,"In a 5 1/2 year retrospective study of hospitalized children with OSTEOMYELITIS who had technetium BONE scans, we found that 32 of 38 (84%) had increased radionuclide uptake, 4 (11%) had normal uptake and 2 (5%) had decreased uptake.",BONE,99,102,OSTEOMYELITIS,66,79,0,0.8241633837,-1,-1,-1,-1,-1,-1,-1,-1,-1,-1,-1,BONE,OSTEOMYELITIS,RO-disease_has_primary_anatomic_site
902226,"Such studies are of particular interest in patients with recurrent chest infections, to detect abnormalities of local cellular immunity; in pulmonary fibrosis to assess activity of the disease and effect of treatment by observing morphology and testing function of FREE LUNG CELLS; and in BRONCHIAL CARCINOMA to investigate local immune responses to the tumour.",FREE LUNG CELLS,265,279,BRONCHIAL CARCINOMA,289,308,0.1924500897,0.5773502692,0.865408348283333,-0.855662432725,-0.90377495515,-0.9278312163625,-0.94226497309,-0.951887477575,-0.958760695064286,-0.96391560818125,-0.96792498505,-1,-1,LUNG,BRONCHIAL CARCINOMA,RO-disease_has_primary_anatomic_site
902239,"Moreover, the formation of large nuclear inclusions filled with smooth filaments appears to be a characteristic process of SSPE, but not of measles, since this type of inclusion is invariably seen in SSPE BRAIN TISSUES BRAIN cultures derived from them, and CV 1 cells infected with SSPE viruses.",BRAIN,205,209,SSPE BRAIN TISSUES,200,218,0.1139605765,0.9116846117,0.85232676275,-0.914529567625,-0.94301971175,-0.9572647838125,-0.96581182705,-0.971509855875,-0.975579876464286,-0.97863239190625,-0.981006570583333,-1,-1,BRAIN,SSPE,RO-disease_has_primary_anatomic_site
902241,"Chronic beryllium DISEASE (CBD) AND PULMONARY SARCOIDOSIS ARE TWO DISTINCT chronic disorders, sharing the PATHOLOGICAL LUNG HALLMARK of the non caseating granuloma and the immunological feature of T cell activation at the site of disease.",PATHOLOGICAL LUNG HALLMARK,106,131,DISEASE (CBD) AND PULMONARY SARCOIDOSIS ARE TWO DISTINCT,18,73,0.8846517369,0.8846517369,0.980775289483333,0.97837220066875,0.97528251505,0.971162934225,0.96539552107,0.9567444013375,0.94232586845,0.913488802675,-0.85255804385,-1,-1,LUNG,PULMONARY SARCOIDOSIS,RO-disease_has_primary_anatomic_site
902253,progression to overt hypothyroidism or hyperthyroidism in female relatives of patients with autoimmune thyroid disease using the Thyroid Events Amsterdam (THEA) score  Subclinical hypothyroidism and functional mobility in older adults  British Medical Journal  Serum thyroid stimulating hormone in assessment of severity of tissue hypothyroidism in patients with OVERT PRIMARY THYROID FAILURE: cross sectional survey  Disorders of sodium balance  Cancer  HYPOTHYROIDISM: a frequent event after radiotherapy and after radiotherapy with chemotherapy for patients with head and neck carcinoma  Journal of the American Medical Association  Radiation dose response relationships for thyroid nodules and autoimmune thyroid diseases in.,HYPOTHYROIDISM,455,469,OVERT PRIMARY THYROID FAILURE,363,391,0.6575959492,0.6575959492,0.9429326582,0.935799240475,0.9266277034,0.9143989873,0.89727878476,0.87159848095,-0.859086582314286,-0.876700759525,-0.890400675133333,-1,1,THYROID,HYPOTHYROIDISM,RO-disease_has_primary_anatomic_site
902259,"The clinical features of the disease were morning stiffness, pain and limitation of motion of the dorsolumbar spine in four of the five members, associated with arthritis of the SMALL JOINTS OF THE HANDS in three, shoulder periARTHRITIS in two and costal cartilage pain in one.",SMALL JOINTS OF THE HANDS,178,203,ARTHRITIS,227,236,0.2182178902,0.8728715609,0.8697029817,0.8534158544125,-0.8908910549,-0.918168291175,-0.93453463294,-0.94544552745,-0.953239023528571,-0.9590841455875,-0.963630351633333,-1,-1,JOINTS,ARTHRITIS,RO-disease_has_primary_anatomic_site
902260,The sap of the plant Euphorbia peplus is a traditional remedy for SKIN CONDITIONS including ACTINIC KERATOSIS,SKIN CONDITIONS,66,80,ACTINIC KERATOSIS,92,109,0.1561737619,0.7808688094,0.85936229365,-0.882869678575,-0.92191311905,-0.9414348392875,-0.95314787143,-0.960956559525,-0.966534193878571,-0.97071741964375,-0.973971039683333,-1,-1,SKIN,ACTINIC KERATOSIS,RO-disease_has_primary_anatomic_site
902273,"CENTRAL NERVOUS SYSTEM (CNS) embryonal tumors are devastating cancers in children, consisting of MEDULLOBLASTOMAS CNS primitive neuroectodermal tumors, and atypical teratoid/rhabdoid tumors.",MEDULLOBLASTOMAS,97,113,CENTRAL NERVOUS SYSTEM,0,21,0.6868028197,0.6868028197,0.94780046995,0.94127552869375,0.932886318507143,0.921700704925,0.90604084591,0.8825510573875,-0.852827967207143,-0.87122447130625,-0.885532863383333,-1,-1,CENTRAL NERVOUS SYSTEM,MEDULLOBLASTOMAS,RO-disease_has_primary_anatomic_site
902277,Clinical and laboratory examinations of 250 patients with chronic DERMATOSES (ECZEMA NEURODERMATITIS PSORIASIS PEMPHIGUS ETC) have revealed secondary candidal INVOLVEMENT OF THE SKIN AND MUCOSA in 121 (46.6%.,INVOLVEMENT OF THE SKIN AND MUCOSA,159,192,DERMATOSES (ECZEMA NEURODERMATITIS PSORIASIS PEMPHIGUS ETC),66,125,0.8834522086,0.8834522086,0.9805753681,0.9781472891125,0.975025473271429,0.97086305215,0.96503566258,0.956294578225,0.9417261043,0.91258915645,-0.852757965233333,-1,-1,SKIN,PSORIASIS,RO-disease_has_primary_anatomic_site
902284,Neurotropic JC virus reaches the BRAIN and causes progressive MULTIFOCAL LEUKOENCEPHALOPATHY a demyelinating disease of the central nervous system with a high mortality rate.,MULTIFOCAL LEUKOENCEPHALOPATHY,62,92,BRAIN,33,37,0.314485451,0.943456353,0.885747575166667,0.8714660220625,0.853104025214286,-0.882067955875,-0.9056543647,-0.92137863725,-0.9326102605,-0.9410339779375,-0.947585758166667,-1,-1,BRAIN,MULTIFOCAL LEUKOENCEPHALOPATHY,RO-disease_has_primary_anatomic_site
902285,A variety of liver diseases including CHRONIC HEPATITIS and cirrhosis were seen in the LIVERS of a majority of the ducks from Chi tung.,LIVERS,87,93,CHRONIC HEPATITIS,38,55,0.1373605639,0.9615239476,0.85622676065,-0.896979577075,-0.93131971805,-0.9484897885375,-0.95879183083,-0.965659859025,-0.97056559345,-0.97424489426875,-0.977106572683333,-1,-1,LIVERS,CHRONIC HEPATITIS,RO-disease_has_primary_anatomic_site
902286,"BREAST CANCER  It was predicted that in the United States in 2007, INVASIVE BREAST CANCER would be diagnosed in an estimated 178,480 women; in situ disease would be diagnosed in 62,030 women; and 40,460 women would die of the disease.",BREAST CANCER,0,12,INVASIVE BREAST CANCER,67,89,0.1290994449,0.9036961141,0.854849907483333,-0.903175416325,-0.93545027755,-0.9515877081625,-0.96127016653,-0.967725138775,-0.972335833235714,-0.97579385408125,-0.97848342585,-1,-1,BREAST,INVASIVE BREAST CANCER,RO-disease_has_primary_anatomic_site
902293,ARTHRITIS developed in all JOINTS in which the prosthesis elongated or broke.,JOINTS,27,32,ARTHRITIS,0,9,0.4330127019,0.8660254038,0.905502116983333,0.89368988160625,0.878502721835714,0.858253175475,-0.87009618943,-0.891746824525,-0.907211563878571,-0.91881011839375,-0.92783121635,-1,1,JOINTS,ARTHRITIS,RO-disease_has_primary_anatomic_site
902294,"In addition to the characterization of the degree of inflammation and fibrosis, the evaluation of a LIVER BIOPSY SPECIMEN from a patient with CHRONIC HEPATITIS includes a description of all of the findings present (e.g., steatosis, bile duct changes, granulomas, type of inflammatory cells, presence of iron, and Mallory hyaline) or a notation of their absence.",LIVER BIOPSY SPECIMEN,100,120,CHRONIC HEPATITIS,142,159,0.3077935056,0.9233805169,0.884632250933333,0.8702112823,0.851670036914286,-0.8845774354,-0.90766194832,-0.9230516236,-0.9340442488,-0.9422887177,-0.9487010824,-1,-1,LIVER,CHRONIC HEPATITIS,RO-disease_has_primary_anatomic_site
902308,The progressive radiological changes in the PATELLO FEMORAL JOINT after upper tibial osteotomy performed for ARTHROSIS OF THE KNEE were studied more than 10 years after the surgical procedure.,PATELLO FEMORAL JOINT,44,64,ARTHROSIS OF THE KNEE,109,130,0.1125087901,0.9000703207,0.85208479835,-0.915618407425,-0.94374560495,-0.9578092037125,-0.96624736297,-0.971872802475,-0.97589097355,-0.97890460185625,-0.981248534983333,-1,-1,JOINT,ARTHROSIS,RO-disease_has_primary_anatomic_site
902320,"SEE:   liver    liver transplantation    The surgical implantation of a donor liver into a patient with END STAGE LIVER DISEASE whether it is caused by ALCOHOLIC CIRRHOSIS chronic cholestatic diseases, chronic or fulminant hepatitis, or toxic liver destruction.",END STAGE LIVER DISEASE,104,126,ALCOHOLIC CIRRHOSIS,152,171,0.9958932065,0.9958932065,0.999315534416667,0.99922997621875,0.999119972821429,0.998973301625,0.99876796195,0.9984599524375,0.99794660325,0.996919904875,0.99383980975,-1,1,LIVER,CIRRHOSIS,RO-disease_has_primary_anatomic_site
902325,"BENIGN MUCOUS MEMBRANE PEMPHIGOID (BMMP) is characterized by immunoglobulin deposits along the basal zone of the SKIN and mucous membranes, leading to blistering erosions of the involved regions.",SKIN,113,116,BENIGN MUCOUS MEMBRANE PEMPHIGOID,0,33,0,0.9878291611,-1,-1,-1,-1,-1,-1,-1,-1,-1,-1,-1,SKIN,BENIGN MUCOUS MEMBRANE PEMPHIGOID,RO-disease_has_primary_anatomic_site
902328,The senior author has performed the Swanson implant arthroplasty for ARTHRITIS of THE BASAL JOINT OF THE THUMB for the past 12 years.,THE BASAL JOINT OF THE THUMB,82,109,ARTHRITIS,69,78,0,0.9853292782,-1,-1,-1,-1,-1,-1,-1,-1,-1,-1,-1,JOINT,ARTHRITIS,RO-disease_has_primary_anatomic_site
902330,"Therefore, although serum P III P can be a useful marker in HEPATOCELLULAR CARCINOMA it may possibly be difficult to discriminate it from benign diseases involving the LIVER and biliary tract.",HEPATOCELLULAR CARCINOMA,60,84,LIVER,168,173,0.7071067812,0.7071067812,0.951184463533333,0.945082521475,0.9372371674,0.9267766953,0.91213203436,0.89016504295,0.8535533906,-0.867417478525,-0.8821488698,-1,1,LIVER,HEPATOCELLULAR CARCINOMA,RO-disease_has_primary_anatomic_site
902331,This study shows that both recombinant human interleukin (rhIL)3 and rhIL4 induced proliferation in BONE MARROW (BM) cells of MYELOGENOUS LEUKEMIA patients in a manner similar to that reported using normal BM cells.,BONE MARROW,100,110,MYELOGENOUS LEUKEMIA,126,146,0.2828427125,0.8485281374,0.880473785416667,0.86553300859375,-0.85857864375,-0.8939339828125,-0.91514718625,-0.929289321875,-0.939390847321429,-0.94696699140625,-0.952859547916667,-1,-1,BONE MARROW,MYELOGENOUS LEUKEMIA,RO-disease_has_primary_anatomic_site
